{
  "vacancy_id": "MY-FE-0008",
  "checked_at": "2026-09-30T03:03:00+08:00",
  "active_status": true,
  "title_verified": true,
  "malaysia_verified": true,
  "job_url": "https://malaysia.indeed.com/viewjob?jk=a88eab18260c9771",
  "source": "Indeed - Encora",
  "status_evidence": "Indeed and a contemporaneous Jora index displayed the Kuala Lumpur role as an active contract vacancy.",
  "title_evidence": "Observed title is Cloud Project Manager – FinOps engineer, containing the contiguous phrase FinOps engineer.",
  "location_evidence": "Observed location is Kuala Lumpur, Malaysia.",
  "notes": "Included under the locked contiguous-title rule even though the title also contains Cloud Project Manager."
}
