{
  "vacancy_id": "MY-FE-0009",
  "checked_at": "2026-09-30T03:03:00+08:00",
  "active_status": true,
  "title_verified": true,
  "malaysia_verified": true,
  "job_url": "https://getmalaysiajobs.com/jobs/view/finops-engineer",
  "source": "GetMalaysiaJobs - Softenger",
  "status_evidence": "GetMalaysiaJobs displayed Apply Now, Full Time, Kuala Lumpur and a recent posting age for the Softenger vacancy when checked. Dedicated revalidation also found a Softenger Malaysia recruiter post listing FinOps Engineer for AWS and OCI.",
  "title_evidence": "Observed title is FinOps Engineer.",
  "location_evidence": "Observed location is Kuala Lumpur, Malaysia.",
  "notes": "GetMalaysiaJobs remains the primary vacancy page; a Softenger Malaysia recruiter post provides secondary corroboration. Role text is similar to other insurance-sector AWS/OCI FinOps hiring, but no explicit shared requisition with NTT DATA was confirmed, so it remains a separate vacancy."
}
